{
    "repr_width": 120,
    "default_duration": 30,
    "default_priority": 10,
    "default_sleep_priority": 70,
    "default_interval": 7,
    "default_cluster_size": 1,
    "default_order": 50.0,
    "default_normaltime": 30,
    "default_idealtime_factor": 1.5,
    "default_mintime_factor": 0.5,
    "default_maxtime_factor": 2.0,
    "default_categories": "wildcard",
    "default_ismovable": true,
    "default_alignend": false,
    "default_day_start": "05:00",
    "default_day_end": "22:00",
    "default_empty_blocks": "wildcard",
    "default_project_dates_missing_offset": 730,
    "default_project_dates_missing_hashmod": 30,
    "default_schedule_weight_interval_min": 1.0,
    "default_schedule_weight_interval_max": 1.1,
    "default_sched_weight_transform_exp": 2,
    "default_sleep_delta_min": 60,
    "default_sleep_delta_max": 60
}